{
  "case_id": "micro-charged-with-reversed",
  "expected_rule_ids": ["CRIT-H-CHARGED-WITH-REVERSED"],
  "forbidden_rule_ids_on_gold": [],
  "expected_severities_min": {
    "CRIT-H-CHARGED-WITH-REVERSED": "high"
  },
  "expect_validation": {
    "allow_unavailable": true
  },
  "expect_zero_unexpected_critical_high": false,
  "allowed_repairs": [],
  "forbidden_regressions": []
}
